[
 {
  "record_id": "ar_0",
  "site_id": "lwas",
  "source_message_id": "msg_0_20",
  "sent_at": "2026-09-10T07:00:00+07:00",
  "sender_raw": "Amartha",
  "sender_person_id": null,
  "confidence": 0.9,
  "area_id": "air_curtain_stainless_pintu_masuk",
  "label": "Air curtain stainless pintu masuk",
  "zone": null
 },
 {
  "record_id": "ar_1",
  "site_id": "lwas",
  "source_message_id": "msg_0_20",
  "sent_at": "2026-09-10T07:01:00+07:00",
  "sender_raw": "Amartha",
  "sender_person_id": null,
  "confidence": 0.9,
  "area_id": "area_apong",
  "label": "Area APONG",
  "zone": null
 },
 {
  "record_id": "ar_2",
  "site_id": "lwas",
  "source_message_id": "msg_0_21",
  "sent_at": "2026-09-10T07:02:00+07:00",
  "sender_raw": "Amartha",
  "sender_person_id": null,
  "confidence": 0.9,
  "area_id": "area_depan_kantor_cs",
  "label": "Area depan kantor CS",
  "zone": null
 },
 {
  "record_id": "ar_3",
  "site_id": "lwas",
  "source_message_id": "msg_0_21",
  "sent_at": "2026-09-10T07:03:00+07:00",
  "sender_raw": "Amartha",
  "sender_person_id": null,
  "confidence": 0.9,
  "area_id": "area_gas_tank",
  "label": "Area Gas Tank",
  "zone": null
 },
 {
  "record_id": "ar_4",
  "site_id": "lwas",
  "source_message_id": "msg_0_21",
  "sent_at": "2026-09-10T07:04:00+07:00",
  "sender_raw": "Amartha",
  "sender_person_id": null,
  "confidence": 0.9,
  "area_id": "area_mushola_lt2",
  "label": "Area mushola LT2",
  "zone": null
 },
 {
  "record_id": "ar_5",
  "site_id": "lwas",
  "source_message_id": "msg_0_22",
  "sent_at": "2026-09-10T07:05:00+07:00",
  "sender_raw": "Amartha",
  "sender_person_id": null,
  "confidence": 0.9,
  "area_id": "asbak_smoking_area",
  "label": "Asbak area smoking",
  "zone": null
 },
 {
  "record_id": "ar_6",
  "site_id": "lwas",
  "source_message_id": "msg_0_22",
  "sent_at": "2026-09-10T07:06:00+07:00",
  "sender_raw": "Amartha",
  "sender_person_id": null,
  "confidence": 0.9,
  "area_id": "bangku_kayu_batang",
  "label": "Bangku kayu batang",
  "zone": null
 },
 {
  "record_id": "ar_7",
  "site_id": "lwas",
  "source_message_id": "msg_0_22",
  "sent_at": "2026-09-10T07:07:00+07:00",
  "sender_raw": "Amartha",
  "sender_person_id": null,
  "confidence": 0.9,
  "area_id": "belakang_led",
  "label": "Belakang LED",
  "zone": null
 },
 {
  "record_id": "ar_8",
  "site_id": "lwas",
  "source_message_id": "msg_0_23",
  "sent_at": "2026-09-10T07:08:00+07:00",
  "sender_raw": "Amartha",
  "sender_person_id": null,
  "confidence": 0.9,
  "area_id": "carpark_dinding_mural_area",
  "label": "Carpark dinding mural & area",
  "zone": null
 },
 {
  "record_id": "ar_9",
  "site_id": "lwas",
  "source_message_id": "msg_0_23",
  "sent_at": "2026-09-10T07:09:00+07:00",
  "sender_raw": "Amartha",
  "sender_person_id": null,
  "confidence": 0.9,
  "area_id": "carpark_p1_zona_a",
  "label": "Carpark P1 zona A",
  "zone": null
 },
 {
  "record_id": "ar_10",
  "site_id": "lwas",
  "source_message_id": "msg_0_23",
  "sent_at": "2026-09-10T07:10:00+07:00",
  "sender_raw": "Amartha",
  "sender_person_id": null,
  "confidence": 0.9,
  "area_id": "carpark_p1_zona_ab",
  "label": "Carpark P1 zona AB",
  "zone": null
 },
 {
  "record_id": "ar_11",
  "site_id": "lwas",
  "source_message_id": "msg_0_24",
  "sent_at": "2026-09-10T07:11:00+07:00",
  "sender_raw": "Amartha",
  "sender_person_id": null,
  "confidence": 0.9,
  "area_id": "carpark_p2",
  "label": "Carpark P2",
  "zone": null
 },
 {
  "record_id": "ar_12",
  "site_id": "lwas",
  "source_message_id": "msg_0_24",
  "sent_at": "2026-09-10T07:12:00+07:00",
  "sender_raw": "Amartha",
  "sender_person_id": null,
  "confidence": 0.9,
  "area_id": "carpark_p7_separator_ramp_spiral",
  "label": "Carpark P7 separator ramp spiral",
  "zone": null
 },
 {
  "record_id": "ar_13",
  "site_id": "lwas",
  "source_message_id": "msg_0_24",
  "sent_at": "2026-09-10T07:13:00+07:00",
  "sender_raw": "Amartha",
  "sender_person_id": null,
  "confidence": 0.9,
  "area_id": "carpark_p8",
  "label": "Carpark P8",
  "zone": null
 },
 {
  "record_id": "ar_14",
  "site_id": "lwas",
  "source_message_id": "msg_0_25",
  "sent_at": "2026-09-10T07:14:00+07:00",
  "sender_raw": "Amartha",
  "sender_person_id": null,
  "confidence": 0.9,
  "area_id": "cermin_wastafel_toilet",
  "label": "Cermin wastafel toilet",
  "zone": null
 },
 {
  "record_id": "ar_15",
  "site_id": "lwas",
  "source_message_id": "msg_0_25",
  "sent_at": "2026-09-10T07:15:00+07:00",
  "sender_raw": "Amartha",
  "sender_person_id": null,
  "confidence": 0.9,
  "area_id": "cladding_kolom_dekat_optik_seis",
  "label": "Cladding kolom dekat Optik Seis",
  "zone": null
 },
 {
  "record_id": "ar_16",
  "site_id": "lwas",
  "source_message_id": "msg_0_25",
  "sent_at": "2026-09-10T07:16:00+07:00",
  "sender_raw": "Amartha",
  "sender_person_id": null,
  "confidence": 0.9,
  "area_id": "counter_kopi_kenangan",
  "label": "Counter Kopi Kenangan",
  "zone": null
 },
 {
  "record_id": "ar_17",
  "site_id": "lwas",
  "source_message_id": "msg_0_26",
  "sent_at": "2026-09-10T07:17:00+07:00",
  "sender_raw": "Amartha",
  "sender_person_id": null,
  "confidence": 0.9,
  "area_id": "depan_gate_5",
  "label": "Depan gate 5",
  "zone": null
 },
 {
  "record_id": "ar_18",
  "site_id": "lwas",
  "source_message_id": "msg_0_26",
  "sent_at": "2026-09-10T07:18:00+07:00",
  "sender_raw": "Amartha",
  "sender_person_id": null,
  "confidence": 0.9,
  "area_id": "depan_karada",
  "label": "Depan Karada",
  "zone": null
 },
 {
  "record_id": "ar_19",
  "site_id": "lwas",
  "source_message_id": "msg_0_26",
  "sent_at": "2026-09-10T07:19:00+07:00",
  "sender_raw": "Amartha",
  "sender_person_id": null,
  "confidence": 0.9,
  "area_id": "depan_minoshe_lt2",
  "label": "Depan Minoshe LT2",
  "zone": null
 },
 {
  "record_id": "ar_20",
  "site_id": "lwas",
  "source_message_id": "msg_0_27",
  "sent_at": "2026-09-10T07:20:00+07:00",
  "sender_raw": "Amartha",
  "sender_person_id": null,
  "confidence": 0.9,
  "area_id": "depan_skin_plus",
  "label": "Lantai depan Skin+",
  "zone": null
 },
 {
  "record_id": "ar_21",
  "site_id": "lwas",
  "source_message_id": "msg_0_27",
  "sent_at": "2026-09-10T07:21:00+07:00",
  "sender_raw": "Amartha",
  "sender_person_id": null,
  "confidence": 0.9,
  "area_id": "driver_room_timur",
  "label": "Driver room timur",
  "zone": null
 },
 {
  "record_id": "ar_22",
  "site_id": "lwas",
  "source_message_id": "msg_0_27",
  "sent_at": "2026-09-10T07:22:00+07:00",
  "sender_raw": "Amartha",
  "sender_person_id": null,
  "confidence": 0.9,
  "area_id": "driveway_depan_pintu_kaca",
  "label": "Driveway depan pintu kaca",
  "zone": null
 },
 {
  "record_id": "ar_23",
  "site_id": "lwas",
  "source_message_id": "msg_0_28",
  "sent_at": "2026-09-10T07:23:00+07:00",
  "sender_raw": "Amartha",
  "sender_person_id": null,
  "confidence": 0.9,
  "area_id": "entrance_uniqlo",
  "label": "Entrance Uniqlo",
  "zone": null
 },
 {
  "record_id": "ar_24",
  "site_id": "lwas",
  "source_message_id": "msg_0_28",
  "sent_at": "2026-09-10T07:24:00+07:00",
  "sender_raw": "Amartha",
  "sender_person_id": null,
  "confidence": 0.9,
  "area_id": "eskalator_dari_es_gentong",
  "label": "Eskalator dari Es Gentong",
  "zone": null
 },
 {
  "record_id": "ar_25",
  "site_id": "lwas",
  "source_message_id": "msg_0_28",
  "sent_at": "2026-09-10T07:25:00+07:00",
  "sender_raw": "Amartha",
  "sender_person_id": null,
  "confidence": 0.9,
  "area_id": "fasad_kaca_rangka_east_lobby",
  "label": "Fasad kaca & rangka East Lobby",
  "zone": null
 },
 {
  "record_id": "ar_26",
  "site_id": "lwas",
  "source_message_id": "msg_0_29",
  "sent_at": "2026-09-10T07:26:00+07:00",
  "sender_raw": "Amartha",
  "sender_person_id": null,
  "confidence": 0.9,
  "area_id": "gate_8_area_lift",
  "label": "Gate 8 & area lift",
  "zone": null
 },
 {
  "record_id": "ar_27",
  "site_id": "lwas",
  "source_message_id": "msg_0_29",
  "sent_at": "2026-09-10T07:27:00+07:00",
  "sender_raw": "Amartha",
  "sender_person_id": null,
  "confidence": 0.9,
  "area_id": "green_wall_samping_tenant",
  "label": "Green wall samping tenant",
  "zone": null
 },
 {
  "record_id": "ar_28",
  "site_id": "lwas",
  "source_message_id": "msg_0_29",
  "sent_at": "2026-09-10T07:28:00+07:00",
  "sender_raw": "Amartha",
  "sender_person_id": null,
  "confidence": 0.9,
  "area_id": "halaman_kanopi_pintu_masuk",
  "label": "Halaman & kanopi pintu masuk",
  "zone": null
 },
 {
  "record_id": "ar_29",
  "site_id": "lwas",
  "source_message_id": "msg_0_30",
  "sent_at": "2026-09-10T07:29:00+07:00",
  "sender_raw": "Amartha",
  "sender_person_id": null,
  "confidence": 0.9,
  "area_id": "hand_dryer_toilet",
  "label": "Hand dryer toilet",
  "zone": null
 },
 {
  "record_id": "ar_30",
  "site_id": "lwas",
  "source_message_id": "msg_0_30",
  "sent_at": "2026-09-10T07:30:00+07:00",
  "sender_raw": "Amartha",
  "sender_person_id": null,
  "confidence": 0.9,
  "area_id": "jalur_depan_tenant_area_proyek",
  "label": "Jalur depan tenant area proyek",
  "zone": null
 },
 {
  "record_id": "ar_31",
  "site_id": "lwas",
  "source_message_id": "msg_0_30",
  "sent_at": "2026-09-10T07:31:00+07:00",
  "sender_raw": "Amartha",
  "sender_person_id": null,
  "confidence": 0.9,
  "area_id": "kanopi_depan_lobby_east_dropoff",
  "label": "Kanopi depan Lobby East / dropoff",
  "zone": null
 },
 {
  "record_id": "ar_32",
  "site_id": "lwas",
  "source_message_id": "msg_0_31",
  "sent_at": "2026-09-10T07:32:00+07:00",
  "sender_raw": "Amartha",
  "sender_person_id": null,
  "confidence": 0.9,
  "area_id": "koridor_depan_cmo",
  "label": "Koridor depan CMO",
  "zone": null
 },
 {
  "record_id": "ar_33",
  "site_id": "lwas",
  "source_message_id": "msg_0_31",
  "sent_at": "2026-09-10T07:33:00+07:00",
  "sender_raw": "Amartha",
  "sender_person_id": null,
  "confidence": 0.9,
  "area_id": "koridor_lt1_timur_sudut_plafon",
  "label": "Koridor LT1 Timur, sudut plafon",
  "zone": null
 },
 {
  "record_id": "ar_34",
  "site_id": "lwas",